[
  {
    "combinationId": "sample-20261008-10450118",
    "inputRef": "10450118",
    "itemId": "10450118",
    "zipCodeRequested": "10001",
    "zipCodeResolved": "07094",
    "locationApplied": true,
    "storeId": "3520",
    "storeDistanceMiles": 3.53,
    "status": "success",
    "reasonCode": null,
    "reasonCodes": [],
    "failureStage": null,
    "message": null,
    "title": "Great Value Milk Whole Vitamin D, Half Gallon, 64 fl oz",
    "price": 2.57,
    "currency": "USD",
    "availability": "IN_STOCK",
    "sellerName": "Walmart.com",
    "sellerType": "WALMART",
    "offerScope": "LOCAL_FULFILLMENT",
    "fulfillment": {
      "shipping": "UNAVAILABLE",
      "pickup": "AVAILABLE",
      "delivery": "AVAILABLE"
    },
    "fetchedAt": "2026-10-08T20:07:25.402Z",
    "schemaVersion": "1.1.0",
    "previous": null,
    "changes": [],
    "isFirstObservation": false,
    "latencyMs": 2713
  },
  {
    "combinationId": "sample-20261008-10450114",
    "inputRef": "10450114",
    "itemId": "10450114",
    "zipCodeRequested": "10001",
    "zipCodeResolved": "07094",
    "locationApplied": true,
    "storeId": "3520",
    "storeDistanceMiles": 3.53,
    "status": "success",
    "reasonCode": null,
    "reasonCodes": [],
    "failureStage": null,
    "message": null,
    "title": "Great Value Whole Vitamin D Milk, Gallon",
    "price": 4.25,
    "currency": "USD",
    "availability": "IN_STOCK",
    "sellerName": "Walmart.com",
    "sellerType": "WALMART",
    "offerScope": "LOCAL_FULFILLMENT",
    "fulfillment": {
      "shipping": "UNAVAILABLE",
      "pickup": "AVAILABLE",
      "delivery": "AVAILABLE"
    },
    "fetchedAt": "2026-10-08T20:07:28.249Z",
    "schemaVersion": "1.1.0",
    "previous": null,
    "changes": [],
    "isFirstObservation": false,
    "latencyMs": 2679
  },
  {
    "combinationId": "sample-20261008-10315355",
    "inputRef": "10315355",
    "itemId": "10315355",
    "zipCodeRequested": "10001",
    "zipCodeResolved": "07094",
    "locationApplied": true,
    "storeId": "3520",
    "storeDistanceMiles": 3.53,
    "status": "success",
    "reasonCode": null,
    "reasonCodes": [],
    "failureStage": null,
    "message": null,
    "title": "Great Value White Round Top Bread Loaf, 20 oz",
    "price": 1.52,
    "currency": "USD",
    "availability": "IN_STOCK",
    "sellerName": "Walmart.com",
    "sellerType": "WALMART",
    "offerScope": "LOCAL_FULFILLMENT",
    "fulfillment": {
      "shipping": "UNAVAILABLE",
      "pickup": "AVAILABLE",
      "delivery": "AVAILABLE"
    },
    "fetchedAt": "2026-10-08T20:07:32.349Z",
    "schemaVersion": "1.1.0",
    "previous": null,
    "changes": [],
    "isFirstObservation": false,
    "latencyMs": 2047
  }
]
